[
  {
    "county": "Kanawha",
    "status": "unverified",
    "note": "Business personal property is reported to the county assessor. The assessor's online filing page described only a 2023 window and no business filing, and the state's business return form could not be read, so no current county filing was confirmed.",
    "items": [],
    "checkedOn": "2026-10-15"
  }
]
