[
  {
    "county": "Rutland",
    "status": "none",
    "sourceUrl": "https://tax.vermont.gov/sites/tax/files/documents/AnnualRpt_PersonalPropertyTaxation_2020.pdf",
    "note": "Vermont counties do not tax business personal property; towns do, and each town may exempt business machinery and equipment and inventory separately (32 V.S.A. sections 3848 and 3849). Reports go to the town listers or assessor.",
    "items": [],
    "checkedOn": "2026-10-15"
  },
  {
    "county": "Washington",
    "status": "none",
    "sourceUrl": "https://tax.vermont.gov/sites/tax/files/documents/AnnualRpt_PersonalPropertyTaxation_2020.pdf",
    "note": "Vermont counties do not tax business personal property; towns do, and each town may exempt business machinery and equipment and inventory separately (32 V.S.A. sections 3848 and 3849). Reports go to the town listers or assessor.",
    "items": [],
    "checkedOn": "2026-10-15"
  },
  {
    "county": "Windsor",
    "status": "none",
    "sourceUrl": "https://tax.vermont.gov/sites/tax/files/documents/AnnualRpt_PersonalPropertyTaxation_2020.pdf",
    "note": "Vermont counties do not tax business personal property; towns do, and each town may exempt business machinery and equipment and inventory separately (32 V.S.A. sections 3848 and 3849). Reports go to the town listers or assessor.",
    "items": [],
    "checkedOn": "2026-10-15"
  }
]
